{
  "artifact_kind": "candidate_set",
  "queue_id": "queue-001",
  "base_ref": "origin/main@deadbeef",
  "candidates": [
    {
      "candidate_id": "cand-001",
      "work_item_id": "wi-001",
      "patch_proposal_path": "state/out/cand-001/patch_proposal.json",
      "evidence_path": "state/out/cand-001/evidence.json",
      "gate_worker_path": "state/out/cand-001/gate_worker.json",
      "created_at": "2026-02-03T10:00:00-0500",
      "metrics": {
        "diff_lines_total": 10,
        "files_touched": 2,
        "checks_passed": 2,
        "checks_failed": 0,
        "policy_warnings": 0
      },
      "pattern": "fix"
    }
  ]
}
